,Unnamed: 0,School Name,Applicants,Admitted,Enrolled,Acceptance Rate,Admission Yield,State
6,,"Athena Career Academy  Toledo, OH",275,107,50,38.91%,46.73%,OH
7,,"Aultman College of Nursing and Health Sciences  Canton, OH",67,50,34,74.63%,68.00%,OH
8,,"Baldwin Wallace University  Berea, OH",3926,2905,668,73.99%,22.99%,OH
9,,"Bluffton University  Bluffton, OH",2175,914,174,42.02%,19.04%,OH
10,,"Bowling Green State University-Main Campus  Bowling Green, OH",17034,12264,3311,72.00%,27.00%,OH
11,,"Canton City Schools Adult Career and Technical Education  Canton, OH",22,13,13,59.09%,100.00%,OH
12,,"Capital University  Columbus, OH",3958,2889,578,72.99%,20.01%,OH
13,,"Case Western Reserve University  Cleveland, OH",26642,7726,1391,29.00%,18.00%,OH
14,,"Cedarville University  Cedarville, OH",3741,2955,916,78.99%,31.00%,OH
15,,"Central State University  Wilberforce, OH",12353,7041,775,57.00%,11.01%,OH
16,,"Chamberlain University-Ohio  Columbus, OH",17,12,9,70.59%,75.00%,OH
17,,"Cincinnati Christian University  Cincinnati, OH",760,319,242,41.97%,75.86%,OH
18,,"Cleveland Institute of Art  Cleveland, OH",1025,748,172,72.98%,22.99%,OH
19,,"Cleveland Institute of Music  Cleveland, OH",504,186,63,36.90%,33.87%,OH
20,,"Cleveland State University  Cleveland, OH",9918,8728,1920,88.00%,22.00%,OH
21,,"Columbus College of Art and Design  Columbus, OH",843,742,237,88.02%,31.94%,OH
22,,"Defiance College  Defiance, OH",1502,781,156,52.00%,19.97%,OH
23,,"Denison University  Granville, OH",8042,2734,656,34.00%,23.99%,OH
24,,"DeVry University-Ohio  Columbus, OH",42,39,32,92.86%,82.05%,OH
25,,"Franciscan University of Steubenville  Steubenville, OH",2100,1617,582,77.00%,35.99%,OH
26,,"Gods Bible School and College  Cincinnati, OH",118,58,46,49.15%,79.31%,OH
27,,"Good Samaritan College of Nursing and Health Science  Cincinnati, OH",315,139,96,44.13%,69.06%,OH
28,,"Hannah E Mullins School of Practical Nursing  Salem, OH",30,24,24,80.00%,100.00%,OH
29,,"Heidelberg University  Tiffin, OH",1757,1283,334,73.02%,26.03%,OH
30,,"Herzing University-Akron  Akron, OH",82,82,46,100.00%,56.10%,OH
31,,"Hiram College  Hiram, OH",2687,1558,234,57.98%,15.02%,OH
32,,"Hondros College of Nursing  Westerville, OH",216,143,82,66.20%,57.34%,OH
33,,"John Carroll University  University Heights, OH",4007,3326,832,83.00%,25.02%,OH
34,,"Kent State University at Kent  Kent, OH",16337,13886,4444,85.00%,32.00%,OH
35,,"Kenyon College  Gambier, OH",6152,2215,532,36.00%,24.02%,OH
36,,"Kettering College  Kettering, OH",199,54,51,27.14%,94.44%,OH
37,,"Lake Erie College  Painesville, OH",1523,990,198,65.00%,20.00%,OH
38,,"Lourdes University  Sylvania, OH",949,845,194,89.04%,22.96%,OH
39,,"Malone University  Canton, OH",2039,1427,314,69.99%,22.00%,OH
40,,"Marietta College  Marietta, OH",2851,1967,354,68.99%,18.00%,OH
41,,"MDT College of Health Sciences  Highland Heights, OH",142,74,18,52.11%,24.32%,OH
42,,"Mercy College of Ohio  Toledo, OH",232,130,68,56.03%,52.31%,OH
43,,"Miami University-Oxford  Oxford, OH",30126,22595,4067,75.00%,18.00%,OH
44,,"Mount Carmel College of Nursing  Columbus, OH",165,129,68,78.18%,52.71%,OH
45,,"Mount Saint Joseph University  Cincinnati, OH",1832,1099,319,59.99%,29.03%,OH
46,,"Mount Vernon Nazarene University  Mount Vernon, OH",1427,1085,380,76.03%,35.02%,OH
47,,"Muskingum University  New Concord, OH",2175,1566,376,72.00%,24.01%,OH
48,,"Notre Dame College  Cleveland, OH",2376,2138,299,89.98%,13.99%,OH
49,,"Oberlin College  Oberlin, OH",7525,2709,813,36.00%,30.01%,OH
50,,"Ohio Dominican University  Columbus, OH",1550,1163,256,75.03%,22.01%,OH
51,,"Ohio Northern University  Ada, OH",4334,2947,678,68.00%,23.01%,OH
52,,"Ohio State University-Main Campus  Columbus, OH",48077,25000,8000,52.00%,32.00%,OH
53,,"Ohio University-Main Campus  Athens, OH",23385,18240,4013,78.00%,22.00%,OH
54,,"Ohio Wesleyan University  Delaware, OH",4705,3246,454,68.99%,13.99%,OH
55,,"Otterbein University  Westerville, OH",2919,2364,567,80.99%,23.98%,OH
56,,"Pontifical College Josephinum  Columbus, OH",6,5,4,83.33%,80.00%,OH
57,,"Professional Skills Institute  Maumee, OH",46,36,20,78.26%,55.56%,OH
58,,"Rabbinical College Telshe  Wickliffe, OH",25,21,19,84.00%,90.48%,OH
59,,"TDDS Technical Institute  Lake Milton, OH",637,401,317,62.95%,79.05%,OH
60,,"The Art Institute of Cincinnati-AIC College of Design  Cincinnati, OH",39,16,10,41.03%,62.50%,OH
61,,"The Christ College of Nursing and Health Sciences  Cincinnati, OH",275,176,79,64.00%,44.89%,OH
62,,"The College of Wooster  Wooster, OH",6244,3372,573,54.00%,16.99%,OH
63,,"The University of Findlay  Findlay, OH",3462,2562,564,74.00%,22.01%,OH
64,,"Tiffin University  Tiffin, OH",3977,2744,494,69.00%,18.00%,OH
65,,"Trinity Health System School of Nursing  Steubenville, OH",8,8,7,100.00%,87.50%,OH
66,,"University of Akron Main Campus  Akron, OH",16088,11101,2775,69.00%,25.00%,OH
67,,"University of Cincinnati-Main Campus  Cincinnati, OH",23296,17006,5272,73.00%,31.00%,OH
68,,"University of Dayton  Dayton, OH",16793,12091,2176,72.00%,18.00%,OH
69,,"University of Mount Union  Alliance, OH",2396,2300,621,95.99%,27.00%,OH
70,,"University of Toledo  Toledo, OH",10792,10144,3246,94.00%,32.00%,OH
71,,"Urbana University  Urbana, OH",518,513,128,99.03%,24.95%,OH
72,,"Ursuline College  Pepper Pike, OH",528,475,95,89.96%,20.00%,OH
73,,"Virginia Marti College of Art and Design  Lakewood, OH",17,14,14,82.35%,100.00%,OH
74,,"Walsh University  North Canton, OH",1770,1381,456,78.02%,33.02%,OH
75,,"Wilberforce University  Wilberforce, OH",3567,2390,239,67.00%,10.00%,OH
76,,"Wilmington College  Wilmington, OH",1694,1440,389,85.01%,27.01%,OH
77,,"Wittenberg University  Springfield, OH",7393,5471,492,74.00%,8.99%,OH
78,,"Wright State University-Lake Campus  Celina, OH",357,353,219,98.88%,62.04%,OH
79,,"Wright State University-Main Campus  Dayton, OH",5820,5529,1935,95.00%,35.00%,OH
80,,"Xavier University  Cincinnati, OH",15100,11174,1453,74.00%,13.00%,OH
81,,"Youngstown State University  Youngstown, OH",10635,7338,2348,69.00%,32.00%,OH
82,,Average,4914,3260,792,66.34%,24.28%,OH
0,,"Autry Technology Center  Enid, OK",165,153,153,92.73%,100.00%,OK
1,,"Bacone College  Muskogee, OK",761,114,40,14.98%,35.09%,OK
2,,"East Central University  Ada, OK",812,674,499,83.00%,74.04%,OK
3,,"Family of Faith Christian University  Shawnee, OK",4,1,0,25.00%,0.00%,OK
4,,"Green Country Technology Center  Okmulgee, OK",127,69,39,54.33%,56.52%,OK
5,,"Moore Norman Technology Center  Norman, OK",1493,1254,301,83.99%,24.00%,OK
6,,"Northeastern State University  Tahlequah, OK",1787,1751,858,97.99%,49.00%,OK
7,,"Northwestern Oklahoma State University  Alva, OK",1170,725,370,61.97%,51.03%,OK
8,,"Oklahoma Baptist University  Shawnee, OK",4334,2774,527,64.01%,19.00%,OK
9,,"Oklahoma Christian University  Edmond, OK",2452,1594,462,65.01%,28.98%,OK
10,,"Oklahoma City University  Oklahoma City, OK",1755,1334,374,76.01%,28.04%,OK
11,,"Oklahoma State University-Main Campus  Stillwater, OK",14405,10660,4157,74.00%,39.00%,OK
12,,"Oklahoma Wesleyan University  Bartlesville, OK",2454,1669,200,68.01%,11.98%,OK
13,,"Oral Roberts University  Tulsa, OK",2867,2322,534,80.99%,23.00%,OK
14,,"Randall University  Moore, OK",202,101,79,50.00%,78.22%,OK
15,,"Southeastern Oklahoma State University  Durant, OK",1207,905,588,74.98%,64.97%,OK
16,,"Southwestern Christian University  Bethany, OK",569,455,146,79.96%,32.09%,OK
17,,"Southwestern Oklahoma State University  Weatherford, OK",2505,2305,991,92.02%,42.99%,OK
18,,"University of Central Oklahoma  Edmond, OK",5377,4194,2097,78.00%,50.00%,OK
19,,"University of Oklahoma-Norman Campus  Norman, OK",15811,12333,4440,78.00%,36.00%,OK
20,,"University of Science and Arts of Oklahoma  Chickasha, OK",1563,828,215,52.98%,25.97%,OK
21,,"University of Tulsa  Tulsa, OK",8526,3496,804,41.00%,23.00%,OK
22,,Average,3198,2260,851,70.67%,37.67%,OK
0,,"American College of Healthcare Sciences  Portland, OR",6,6,6,100.00%,100.00%,OR
1,,"Carrington College-Portland  Portland, OR",61,51,35,83.61%,68.63%,OR
2,,"Christian Culinary Academy  Cannon Beach, OR",11,10,10,90.91%,100.00%,OR
3,,"Concorde Career College-Portland  Portland, OR",322,283,76,87.89%,26.86%,OR
4,,"Concordia University-Portland  Portland, OR",2290,1374,247,60.00%,17.98%,OR
5,,"Corban University  Salem, OR",924,841,202,91.02%,24.02%,OR
6,,"Eastern Oregon University  La Grande, OR",1014,994,318,98.03%,31.99%,OR
7,,"George Fox University  Newberg, OR",2888,2368,592,81.99%,25.00%,OR
8,,"Lewis & Clark College  Portland, OR",6139,4543,545,74.00%,12.00%,OR
9,,"Linfield College-McMinnville Campus  McMinnville, OR",2199,1781,321,80.99%,18.02%,OR
10,,"Mount Angel Seminary  Saint Benedict, OR",4,4,3,100.00%,75.00%,OR
11,,"Multnomah University  Portland, OR",256,138,72,53.91%,52.17%,OR
12,,"New Hope Christian College-Eugene  Eugene, OR",29,29,21,100.00%,72.41%,OR
13,,"Northwest Christian University  Eugene, OR",479,297,98,62.00%,33.00%,OR
14,,"Oregon College of Art and Craft  Portland, OR",66,65,16,98.48%,24.62%,OR
15,,"Oregon Institute of Technology  Klamath Falls, OR",939,901,360,95.95%,39.96%,OR
16,,"Oregon State University  Corvallis, OR",14890,12061,3739,81.00%,31.00%,OR
17,,"Oregon State University-Cascades Campus  Bend, OR",477,372,100,77.99%,26.88%,OR
18,,"Pacific Northwest College of Art  Portland, OR",1144,1064,128,93.01%,12.03%,OR
19,,"Pacific University  Forest Grove, OR",2491,2117,423,84.99%,19.98%,OR
20,,"Portland State University  Portland, OR",6743,6069,1881,90.00%,30.99%,OR
21,,"Reed College  Portland, OR",5957,2085,354,35.00%,16.98%,OR
22,,"Southern Oregon University  Ashland, OR",2779,2112,634,76.00%,30.02%,OR
23,,"Sumner College  Portland, OR",9,9,9,100.00%,100.00%,OR
24,,"University of Oregon  Eugene, OR",24474,20313,4063,83.00%,20.00%,OR
25,,"University of Portland  Portland, OR",10666,8000,960,75.00%,12.00%,OR
26,,"Warner Pacific College  Portland, OR",508,493,64,97.05%,12.98%,OR
27,,"Western Oregon University  Monmouth, OR",3201,2689,807,84.00%,30.01%,OR
28,,"Willamette University  Salem, OR",4206,3533,389,84.00%,11.01%,OR
29,,Average,3282,2572,568,78.39%,22.08%,OR
0,,"Albright College  Reading, PA",6755,4188,586,62.00%,13.99%,PA
1,,"Allegheny College  Meadville, PA",5479,3507,491,64.01%,14.00%,PA
2,,"Alvernia University  Reading, PA",2628,1787,429,68.00%,24.01%,PA
3,,"Arcadia University  Glenside, PA",9243,5916,473,64.01%,8.00%,PA
4,,"Bidwell Training Center Inc  Pittsburgh, PA",13,9,6,69.23%,66.67%,PA
5,,"Bloomsburg University of Pennsylvania  Bloomsburg, PA",8748,6736,1819,77.00%,27.00%,PA
6,,"Bryn Athyn College of the New Church  Bryn Athyn, PA",250,223,67,89.20%,30.04%,PA
7,,"Bryn Mawr College  Bryn Mawr, PA",3166,1076,387,33.99%,35.97%,PA
8,,"Bucknell University  Lewisburg, PA",10144,3348,971,33.00%,29.00%,PA
9,,"Cabrini University  Radnor, PA",3565,2567,436,72.01%,16.98%,PA
10,,"Cairn University-Langhorne  Langhorne, PA",539,410,185,76.07%,45.12%,PA
11,,"California University of Pennsylvania  California, PA",2957,2868,1004,96.99%,35.01%,PA
12,,"Carlow University  Pittsburgh, PA",898,781,250,86.97%,32.01%,PA
13,,"Carnegie Mellon University  Pittsburgh, PA",24351,4140,1573,17.00%,38.00%,PA
14,,"Cedar Crest College  Allentown, PA",1343,766,207,57.04%,27.02%,PA
15,,"Central Penn College  Summerdale, PA",280,202,105,72.14%,51.98%,PA
16,,"Central Susquehanna Intermediate Unit LPN Career  Lewisburg, PA",63,30,24,47.62%,80.00%,PA
17,,"Chatham University  Pittsburgh, PA",2761,1519,273,55.02%,17.97%,PA
18,,"Chester County Intermediate Unit  Downingtown, PA",34,33,21,97.06%,63.64%,PA
19,,"Chestnut Hill College  Philadelphia, PA",1008,968,165,96.03%,17.05%,PA
20,,"Citizens School of Nursing  New Kensington, PA",8,4,4,50.00%,100.00%,PA
21,,"Clarion County Career Center Practical Nursing Program  Shippenville, PA",19,19,16,100.00%,84.21%,PA
22,,"Clarion University of Pennsylvania  Clarion, PA",2373,2231,736,94.02%,32.99%,PA
23,,"Clarks Summit University  South Abington Township, PA",211,108,64,51.18%,59.26%,PA
24,,"Curtis Institute of Music  Philadelphia, PA",660,33,29,5.00%,87.88%,PA
25,,"Delaware County Technical School-Practical Nursing Program  Broomall, PA",16,16,16,100.00%,100.00%,PA
26,,"Delaware Valley University  Doylestown, PA",2423,1599,448,65.99%,28.02%,PA
27,,"DeSales University  Center Valley, PA",3190,2520,529,79.00%,20.99%,PA
28,,"DeVry University-Pennsylvania  Ft. Washington, PA",8,8,7,100.00%,87.50%,PA
29,,"Dickinson College  Carlisle, PA",6248,3062,643,49.01%,21.00%,PA
30,,"DLP Conemaugh Memorial Medical Center  Johnstown, PA",42,36,25,85.71%,69.44%,PA
31,,"Drexel University  Philadelphia, PA",30242,23286,3260,77.00%,14.00%,PA
32,,"Duquesne University  Pittsburgh, PA",7505,5404,1513,72.01%,28.00%,PA
33,,"East Stroudsburg University of Pennsylvania  East Stroudsburg, PA",8565,7023,1124,82.00%,16.00%,PA
34,,"Eastern Center for Arts and Technology  Willow Grove, PA",3,3,3,100.00%,100.00%,PA
35,,"Eastern University  Saint Davids, PA",1761,1197,419,67.97%,35.00%,PA
36,,"Edinboro University of Pennsylvania  Edinboro, PA",2325,1860,595,80.00%,31.99%,PA
37,,"Elizabethtown College  Elizabethtown, PA",2010,1528,382,76.02%,25.00%,PA
38,,"Elizabethtown College School of Continuing and Professional Studies  Elizabethtown, PA",6,6,5,100.00%,83.33%,PA
39,,"Franklin and Marshall College  Lancaster, PA",6557,2295,597,35.00%,26.01%,PA
40,,"Gannon University  Erie, PA",5124,4150,789,80.99%,19.01%,PA
41,,"Geisinger-Lewistown Hospital School of Nursing  Lewistown, PA",73,38,32,52.05%,84.21%,PA
42,,"Geneva College  Beaver Falls, PA",1941,1223,306,63.01%,25.02%,PA
43,,"Gettysburg College  Gettysburg, PA",6269,2821,733,45.00%,25.98%,PA
44,,"Greene County Career and Technology Center  Waynesburg, PA",10,10,10,100.00%,100.00%,PA
45,,"Grove City College  Grove City, PA",1814,1433,602,79.00%,42.01%,PA
46,,"Gwynedd Mercy University  Gwynedd Valley, PA",1213,1116,279,92.00%,25.00%,PA
47,,"Haverford College  Haverford, PA",4672,888,364,19.01%,40.99%,PA
48,,"Holy Family University  Philadelphia, PA",1481,1066,352,71.98%,33.02%,PA
49,,"Hussian College School of Art  Philadelphia, PA",194,97,32,50.00%,32.99%,PA
50,,"Immaculata University  Immaculata, PA",1658,1343,188,81.00%,14.00%,PA
51,,"Indiana University of Pennsylvania-Main Campus  Indiana, PA",9910,9216,2120,93.00%,23.00%,PA
52,,"Jameson Health System  New Castle, PA",4,4,2,100.00%,50.00%,PA
53,,"Jefferson County Dubois Area Vocational Technical Practical Nursing Program  Reynoldsville, PA",22,18,14,81.82%,77.78%,PA
54,,"Johnson College  Scranton, PA",196,188,115,95.92%,61.17%,PA
55,,"Juniata College  Huntingdon, PA",2437,1706,341,70.00%,19.99%,PA
56,,"Keystone College  La Plume, PA",2912,2068,331,71.02%,16.01%,PA
57,,"King's College  Wilkes-Barre, PA",4292,3348,569,78.01%,17.00%,PA
58,,"Kutztown University of Pennsylvania  Kutztown, PA",8112,6733,1616,83.00%,24.00%,PA
59,,"La Roche College  Pittsburgh, PA",1309,1296,220,99.01%,16.98%,PA
60,,"La Salle University  Philadelphia, PA",6642,5380,1022,81.00%,19.00%,PA
61,,"Lafayette College  Easton, PA",9237,2679,723,29.00%,26.99%,PA
62,,"Lancaster Bible College  Lancaster, PA",442,283,178,64.03%,62.90%,PA
63,,"Laurel Business Institute  Uniontown, PA",144,144,82,100.00%,56.94%,PA
64,,"Laurel Technical Institute  Sharon, PA",91,85,56,93.41%,65.88%,PA
65,,"Laurel Technical Institute  MEADVILLE, PA",80,77,69,96.25%,89.61%,PA
66,,"Lebanon Valley College  Annville, PA",2731,2130,469,77.99%,22.02%,PA
67,,"Lehigh University  Bethlehem, PA",15622,3437,1272,22.00%,37.01%,PA
68,,"Lincoln University  Lincoln University, PA",7430,3641,546,49.00%,15.00%,PA
69,,"Lock Haven University  Lock Haven, PA",2560,2406,698,93.98%,29.01%,PA
70,,"Lycoming College  Williamsport, PA",2433,1606,321,66.01%,19.99%,PA
71,,"Manor College  Jenkintown, PA",857,806,218,94.05%,27.05%,PA
72,,"Mansfield University of Pennsylvania  Mansfield, PA",1595,1467,323,91.97%,22.02%,PA
73,,"Marywood University  Scranton, PA",2102,1598,384,76.02%,24.03%,PA
74,,"Mercy Hospital School of Nursing  Pittsburgh, PA",22,15,12,68.18%,80.00%,PA
75,,"Mercyhurst University  Erie, PA",3073,1844,645,60.01%,34.98%,PA
76,,"Messiah College  Mechanicsburg, PA",2530,1999,640,79.01%,32.02%,PA
77,,"Mifflin County Academy of Science and Technology  Lewistown, PA",33,28,21,84.85%,75.00%,PA
78,,"Millersville University of Pennsylvania  Millersville, PA",6587,5138,1387,78.00%,26.99%,PA
79,,"Misericordia University  Dallas, PA",1652,1371,411,82.99%,29.98%,PA
80,,"Moore College of Art and Design  Philadelphia, PA",1105,575,104,52.04%,18.09%,PA
81,,"Moravian College  Bethlehem, PA",2443,1783,446,72.98%,25.01%,PA
82,,"Mount Aloysius College  Cresson, PA",1219,1121,258,91.96%,23.02%,PA
83,,"Muhlenberg College  Allentown, PA",4146,2571,540,62.01%,21.00%,PA
84,,"Neumann University  Aston, PA",3112,2147,429,68.99%,19.98%,PA
85,,"New Castle School of Trades  New Castle, PA",187,187,127,100.00%,67.91%,PA
86,,"Northern Tier Career Center  Towanda, PA",43,31,23,72.09%,74.19%,PA
87,,"Ohio Valley Hospital School of Nursing  McKees Rocks, PA",38,28,10,73.68%,35.71%,PA
88,,"Orleans Technical College  Philadelphia, PA",143,61,36,42.66%,59.02%,PA
89,,"Penn Commercial Business/Technical School  Washington, PA",165,132,73,80.00%,55.30%,PA
90,,"Pennsylvania Academy of the Fine Arts  Philadelphia, PA",173,156,34,90.17%,21.79%,PA
91,,"Pennsylvania College of Art and Design  Lancaster, PA",301,132,54,43.85%,40.91%,PA
92,,"Pennsylvania College of Health Sciences  Lancaster, PA",297,220,92,74.07%,41.82%,PA
93,,"Pennsylvania State University-Main Campus  University Park, PA",52742,29536,7975,56.00%,27.00%,PA
94,,"Pennsylvania State University-Penn State Abington  Abington, PA",4545,3863,1043,84.99%,27.00%,PA
95,,"Pennsylvania State University-Penn State Altoona  Altoona, PA",4486,4082,1143,90.99%,28.00%,PA
96,,"Pennsylvania State University-Penn State Beaver  Monaca, PA",1298,831,183,64.02%,22.02%,PA
97,,"Pennsylvania State University-Penn State Berks  Reading, PA",1817,1581,601,87.01%,38.01%,PA
98,,"Pennsylvania State University-Penn State Brandywine  Media, PA",1369,1191,381,87.00%,31.99%,PA
99,,"Pennsylvania State University-Penn State DuBois  DuBois, PA",344,292,143,84.88%,48.97%,PA
100,,"Pennsylvania State University-Penn State Erie-Behrend College  Erie, PA",3392,3019,1057,89.00%,35.01%,PA
101,,"Pennsylvania State University-Penn State Fayette- Eberly  Lemont Furnace, PA",532,426,192,80.08%,45.07%,PA
102,,"Pennsylvania State University-Penn State Greater Allegheny  McKeesport, PA",393,342,116,87.02%,33.92%,PA
103,,"Pennsylvania State University-Penn State Harrisburg  Middletown, PA",4588,4037,1009,87.99%,24.99%,PA
104,,"Pennsylvania State University-Penn State Hazleton  Hazleton, PA",473,407,199,86.05%,48.89%,PA
105,,"Pennsylvania State University-Penn State Lehigh Valley  Center Valley, PA",1045,888,231,84.98%,26.01%,PA
106,,"Pennsylvania State University-Penn State Mont Alto  Mont Alto, PA",554,421,206,75.99%,48.93%,PA
107,,"Pennsylvania State University-Penn State New Kensington  New Kensington, PA",441,353,162,80.05%,45.89%,PA
108,,"Pennsylvania State University-Penn State Schuylkill  Schuylkill Haven, PA",414,306,144,73.91%,47.06%,PA
109,,"Pennsylvania State University-Penn State Shenango  Sharon, PA",165,124,64,75.15%,51.61%,PA
110,,"Pennsylvania State University-Penn State Wilkes-Barre  Lehman, PA",293,252,88,86.01%,34.92%,PA
111,,"Pennsylvania State University-Penn State Worthington Scranton  Dunmore, PA",666,546,224,81.98%,41.03%,PA
112,,"Pennsylvania State University-Penn State York  York, PA",1139,968,252,84.99%,26.03%,PA
113,,"Pennsylvania State University-World Campus  University Park, PA",962,519,218,53.95%,42.00%,PA
114,,"Pittsburgh Institute of Mortuary Science Inc  Pittsburgh, PA",161,101,49,62.73%,48.51%,PA
115,,"Point Park University  Pittsburgh, PA",5834,3792,607,65.00%,16.01%,PA
116,,"Reading Hospital School of Health Sciences  Reading, PA",127,38,31,29.92%,81.58%,PA
117,,"Robert Morris University  Moon Township, PA",6269,5266,790,84.00%,15.00%,PA
118,,"Rosedale Technical College  Pittsburgh, PA",423,343,257,81.09%,74.93%,PA
119,,"Rosemont College  Rosemont, PA",785,699,91,89.04%,13.02%,PA
120,,"Saint Charles Borromeo Seminary-Overbrook  Wynnewood, PA",23,21,20,91.30%,95.24%,PA
121,,"Saint Francis University  Loretto, PA",1706,1280,346,75.03%,27.03%,PA
122,,"Saint Joseph's University  Philadelphia, PA",8843,6721,1143,76.00%,17.01%,PA
123,,"Saint Vincent College  Latrobe, PA",2354,1601,416,68.01%,25.98%,PA
124,,"Seton Hill University  Greensburg, PA",2471,1853,389,74.99%,20.99%,PA
125,,"Shippensburg University of Pennsylvania  Shippensburg, PA",5540,4875,1365,88.00%,28.00%,PA
126,,"Slippery Rock University of Pennsylvania  Slippery Rock, PA",5370,3920,1568,73.00%,40.00%,PA
127,,"South Hills School of Business & Technology  State College, PA",262,257,129,98.09%,50.19%,PA
128,,"St Margaret School of Nursing  Pittsburgh, PA",18,10,8,55.56%,80.00%,PA
129,,"Studio Incamminati  Philadelphia, PA",2,2,1,100.00%,50.00%,PA
130,,"Susquehanna University  Selinsgrove, PA",5684,4092,614,71.99%,15.00%,PA
131,,"Swarthmore College  Swarthmore, PA",10749,967,396,9.00%,40.95%,PA
132,,"Talmudical Yeshiva of Philadelphia  Philadelphia, PA",45,38,36,84.44%,94.74%,PA
133,,"Temple University  Philadelphia, PA",35501,20946,5027,59.00%,24.00%,PA
134,,"Thaddeus Stevens College of Technology  Lancaster, PA",1198,922,526,76.96%,57.05%,PA
135,,"The Restaurant School at Walnut Hill College  Philadelphia, PA",215,200,118,93.02%,59.00%,PA
136,,"The University of the Arts  Philadelphia, PA",1643,1232,419,74.98%,34.01%,PA
137,,"The Workforce Institute's City College  Philadelphia, PA",8,4,2,50.00%,50.00%,PA
138,,"Thiel College  Greenville, PA",1820,1383,235,75.99%,16.99%,PA
139,,"Thomas Jefferson University  Philadelphia, PA",4522,2623,603,58.01%,22.99%,PA
140,,"University of Pennsylvania  Philadelphia, PA",44491,3559,2385,8.00%,67.01%,PA
141,,"University of Pittsburgh Medical Center-Shadyside School of Nursing  Pittsburgh, PA",43,21,21,48.84%,100.00%,PA
142,,"University of Pittsburgh-Bradford  Bradford, PA",3061,1500,360,49.00%,24.00%,PA
143,,"University of Pittsburgh-Greensburg  Greensburg, PA",2324,1487,401,63.98%,26.97%,PA
144,,"University of Pittsburgh-Johnstown  Johnstown, PA",3156,2051,656,64.99%,31.98%,PA
145,,"University of Pittsburgh-Pittsburgh Campus  Pittsburgh, PA",29857,17616,4052,59.00%,23.00%,PA
146,,"University of Pittsburgh-Titusville  Titusville, PA",503,252,73,50.10%,28.97%,PA
147,,"University of Scranton  Scranton, PA",9968,7277,946,73.00%,13.00%,PA
148,,"University of the Sciences  Philadelphia, PA",4212,2654,318,63.01%,11.98%,PA
149,,"University of Valley Forge  Phoenixville, PA",375,221,104,58.93%,47.06%,PA
150,,"Ursinus College  Collegeville, PA",3361,2386,382,70.99%,16.01%,PA
151,,"Villanova University  Villanova, PA",22741,6595,1649,29.00%,25.00%,PA
152,,"Washington & Jefferson College  Washington, PA",2806,2301,345,82.00%,14.99%,PA
153,,"Waynesburg University  Waynesburg, PA",1590,1447,318,91.01%,21.98%,PA
154,,"West Chester University of Pennsylvania  West Chester, PA",12002,8881,2753,74.00%,31.00%,PA
155,,"Western Area Career & Technology Center  Canonsburg, PA",25,22,17,88.00%,77.27%,PA
156,,"Western Pennsylvania Hospital School of Nursing  Pittsburgh, PA",29,29,24,100.00%,82.76%,PA
157,,"Westminster College  New Wilmington, PA",3011,1987,338,65.99%,17.01%,PA
158,,"Widener University  Chester, PA",6422,4431,753,69.00%,16.99%,PA
159,,"Wilkes University  Wilkes-Barre, PA",3932,2949,649,75.00%,22.01%,PA
160,,"Wilkes-Barre Area Career and Technical Center Practical Nursing  Wilkes Barre, PA",236,94,20,39.83%,21.28%,PA
161,,"Wilson College  Chambersburg, PA",824,758,190,91.99%,25.07%,PA
162,,"Yeshivath Beth Moshe  Scranton, PA",11,10,9,90.91%,90.00%,PA
163,,"York College of Pennsylvania  York, PA",5659,3961,990,69.99%,24.99%,PA
164,,Average,3873,2238,544,57.78%,24.30%,PA
0,,"Brown University  Providence, RI",35437,2835,1729,8.00%,60.99%,RI
1,,"Bryant University  Smithfield, RI",7235,5499,880,76.01%,16.00%,RI
2,,"International Yacht Restoration School  Newport, RI",63,17,17,26.98%,100.00%,RI
3,,"Johnson & Wales University-Online  Providence, RI",120,52,31,43.33%,59.62%,RI
4,,"Johnson & Wales University-Providence  Providence, RI",11802,10740,1504,91.00%,14.00%,RI
5,,"MotoRing Technical Training Institute  East Providence, RI",61,61,52,100.00%,85.25%,RI
6,,"Providence College  Providence, RI",11421,5596,1119,49.00%,20.00%,RI
7,,"Rhode Island College  Providence, RI",4208,3072,829,73.00%,26.99%,RI
8,,"Rhode Island School of Design  Providence, RI",3913,939,479,24.00%,51.01%,RI
9,,"Roger Williams University  Bristol, RI",9147,7866,1023,86.00%,13.01%,RI
10,,"Salve Regina University  Newport, RI",4721,3588,502,76.00%,13.99%,RI
11,,"University of Rhode Island  Kingston, RI",22782,15720,2987,69.00%,19.00%,RI
12,,Average,9243,4665,929,50.48%,19.92%,RI
0,,"Anderson University  Anderson, SC",3325,2062,639,62.02%,30.99%,SC
1,,"Charleston Southern University  Charleston, SC",4455,2317,579,52.01%,24.99%,SC
2,,"Citadel Military College of South Carolina  Charleston, SC",2672,2164,714,80.99%,32.99%,SC
3,,"Claflin University  Orangeburg, SC",9678,5420,542,56.00%,10.00%,SC
4,,"Clemson University  Clemson, SC",28845,13557,3796,47.00%,28.00%,SC
5,,"Coastal Carolina University  Conway, SC",14057,9840,2362,70.00%,24.00%,SC
6,,"Coker College  Hartsville, SC",1546,974,292,63.00%,29.98%,SC
7,,"College of Charleston  Charleston, SC",11675,9223,2214,79.00%,24.01%,SC
8,,"Columbia College  Columbia, SC",877,842,160,96.01%,19.00%,SC
9,,"Columbia International University  Columbia, SC",611,202,107,33.06%,52.97%,SC
10,,"Converse College  Spartanburg, SC",1808,1067,213,59.02%,19.96%,SC
11,,"Erskine College  Due West, SC",910,528,201,58.02%,38.07%,SC
12,,"Francis Marion University  Florence, SC",4200,2688,753,64.00%,28.01%,SC
13,,"Furman  Greenville, SC",5469,3336,701,61.00%,21.01%,SC
14,,"Lander University  Greenwood, SC",5454,2345,868,43.00%,37.01%,SC
15,,"Limestone College  Gaffney, SC",3057,1345,390,44.00%,29.00%,SC
